{
  "type": "unit_test",
  "timestamp": "2026-08-24T09:51:27.963407+00:00",
  "command": "python -m pytest tests/ -q",
  "exit_code": 0,
  "commit": "a6e1ea988e24d48dbf250b524b9b62ffcce4b85d",
  "stdout_tail": "........................................................................ [ 41%]\n........................................................................ [ 83%]\n.............................                                            [100%]\n173 passed in 13.87s\n",
  "stderr_tail": ""
}